tipo;descripcion;expediente;anio_expediente;domicilio;barrio;comuna;unidad_ejecutora;fecha_inicio;area;obra;estado_obra;contratista;foto_nombre;foto_descripcion
AUSA;Generacion de aperturas en el Blvard Fernandez de la Cruz frente al Htal Lugano para posibilitar el acceso vehicular rápido desde la Avda Cámpora y permitir el retome hacia Avda escalada. Ejecución de señales y Semaforos. Corrimento y mejora de los andenes del PREmetro y rampas para discapacitados efectos acortar recorridos de los usuarios ;2012 02 0031 00;2012;Avda fernandez de la Cruz y Acda Escalada intercepcion con Premetro ;Villa Lugano;8;998;2012-10-03 00:00:00;Ausa;Acceso Seguro Hospital Lugano ;Paralizada;RICAVIAL SA ;;
AUSA;Conexión de la AU Presidente Arturo Illia con la Avenida del Libertador, mediante dos ramales de circulación. La rama de ingreso, conectará la calle Brigadier General Juan Facundo Quiroga, paralela a la Av. Del Libertador con la autopista, mientras que la de salida, irá desde la autopista hacia Av. del Libertador. ;2013 01 0003 00;2014;AU ILLIA y Brig Gral Quiroga y Avda Libertador ;Retiro ;1;998;2014-01-29 00:00:00;Ausa;AU ILLIA Ramales ingreso y egreso Libertador ;En Ejecucion;Tecma SA Riva SA Posse SRL  UTE;Salida Quiroga1.JPG;Ingreso y egreso Libertador Quiroga 
AUSA;Reemplazo del pavimento asfaltico por el paviemnte de hormigon que se extenderá por 290 mts. Construccion de una canaleta lateral que recoja las aguas y las encuace hacia su desagote  ;2013 004 0049 00;2013;calle 5 de Au Illia (Ramon Castillo) Sentido centro ;Retiro ;1;998;2013-04-09 00:00:00;Ausa;AU Illia salida calle5;Finalizada sin recepción provisoria ;Vialmani SA;;
AUSA;Trabajos complementarios de Remociones de EDENOR en la obra Au Illia tramo Sarmiento cantilo ;2013 04 0130 00;2013;;;;998;2013-07-01 00:00:00;Ausa;AU Illia Sarm Cantilo Rem EDENOR;Finalizada sin recepción provisoria ;EDENOR SA;;
AUSA;Trabajos de tuneleria horizontal dirigida para la ejecucion del cruce en obra AU Illia tramo Sarmiento Cantilo con instalaciones de caños PEAD 60mm longitud de cruce 40 mts a $749 cada metro ;2013 04 0131 00;2013;;;;998;2013-07-01 00:00:00;Ausa;AU Illia Sarm Cantilo Tunel EDENOR ;Finalizada sin recepción provisoria ;Protunel SA;;
AUSA;Materiales utilizados para el servicio de tunerleria correspondiente a 72 mts de caños de PEAD de 160 mm PN 101. LA orden de compra es en dolares estadounidenses abonados en pesos argentinos a cotización de fecha dia anterior a fecha factura. ;2013 04 0132 00;2013;;;;998;2013-07-01 00:00:00;Ausa;AUIllia Sarm Cantilo Materiales Tunel EDENOR ;Finalizada sin recepción provisoria ;Protunel SA;;
AUSA;El proyecto contempla la continuación de la Autopista Arturo Humberto Illia en el sentido Sur-Norte desde la Av. Sarmiento hasta empalmar con la Av. Cantilo poco antes del acceso a Parque Norte. ;LP AUSA 07 2008;2008;Continuación de Autopista Illia desde Sarmiento hasta Cantilo entre FFCC y Aeroparque. Obrador SObre Sarmiento;Palermo;14;998;2010-04-12 00:00:00;Ausa;Autopista Illia Sarmiento Cantilo;En Ejecucion;Vialmani SA;;
AUSA;provision de plantas ;2013 02 0024 00;2013;AU Dellepiane;Villa Lugano y Parque Avellaneda;8;998;2013-05-20 00:00:00;Ausa;Autopistas verdes Jardines verticales ;Finalizada sin recepción provisoria ;Top Sinergia SA ;3-ejemplo de Green Wall.jpg;ejemplo de Green Wall
AUSA;La obra comprende un mejoramiento integral de la Av. Regimiento de los Patricios. La misma esta dividia en dos Etapas. La Etapa I abarca desde Av. Pedro de Mendoza hasta Olavarría, y la Etapa II desde Olavarría hasta Av. Martín García. Se reacondicionará la calzada, las veredas y todos los sistemas de desague, así también como la iluminación.;1;1;Av. Reg. de los Patricios;La Boca;4;998;2009-07-21 00:00:00;Ausa;Av. de los Patricios Etapa II;Finalizada recepción definitiva;Jose Cartelone Construcciones Civiles SA;Patricios-II-NOv09.JPG;Mes 5 - Noviembre
AUSA;La obra comprende el Mejoramiento integral de la Av. Regimiento de los Patricios. La misma esta dividia en dos Etapas. La Etapa I abarca desde Av. Pedro de Mendoza hasta Olavarría, y la Etapa II desde Olavarría hasta Av. Martín García. Se reacondicionará la calzada, las veredas y todos los sistemas de desague, como así la iluminación.;Lic Pub 10 año 2008;2009;Av. Regimiento de los Patricios entre Olavarria y P de Mendoza;Limite entre Boca y Barracas;4;998;2009-04-06 00:00:00;Ausa;Av. Reg de los Patricios Etapa I;Finalizada recepción definitiva;Milicic SA;Patricios-I-100_1012.jpg;Mes 4 - Julio 2009
AUSA;El objetivo de este tipo de obra es la mejora del flujo vehicular en caminos laterales al FFCC, disminuyendo tiempos de recorrido como así también contribuyendo a la descongestión de arterias y mejora en las comunicaciones viales. Reducción  tiempos de viaje y costos a los usuarios de la red evitando inconvenientes y accidentes. ;LP AUSA 20 2010;2010;Aizpurúa entre Roosevelt y Blanco Encalada;Coghlan, Saavedra, Villa Urquiza, Villa Pueyrredón ;12;998;;Ausa;Bajo Nivel Aizpurúa;Paralizada;a designar;;
AUSA;El objetivo principal de la obra es la mejora en el flujo vehicular disminuyendo tiempos de recorrido, aumento en la cantidad de viajes, descongestión de arterias y el mejoramiento en las comunicaciones viales. ;LP AUSA 17 2010;2010;Altolaguirre y Ex FFCC Mitre Ramal Retiro JL Suarez entre Monroe y Roosevelt;Villa Urquiza;12;998;2012-11-21 00:00:00;Ausa;Bajo Nivel Altolaguirre;En Ejecucion;CHEDIACK ESUCO UTE;altolaguirre 1.jpg;render
AUSA;El cruce bajo nivel en la calle Arias, ex FFCC Mitre, supone la generación de un paso que torna más permeable vehicularmente la barrera que supone las vías del ferrocarril Mitre, ramal Mitre en el barrio de Saavedra, suponiendo una alternativa al automóvil que hoy en día circula hacia el este por el paso a nivel de la calle Ruiz Huidobro. Con reducción  tiempos de viaje y costos a los usuarios de la red evitando inconvenientes y accidentes.  ;LP AUSA 07 2010;2010;Calle Arias con ex FFCC Mitre ramal Mitre entre Olof Palme y Plaza;Saavedra ;12;998;2010-10-14 00:00:00;Ausa;Bajo Nivel Arias;Finalizada recepción provisoria parcial;Fontana Nicastro SA de Construcciones;147-Arias-6 agosto 2012.JPG;147-Arias-6 agosto 2012.JPG
AUSA;La obra consiste en la construcción de un cruce bajo nivel peatonal y vehicular que une la calle Besares hoy interrumpida por el Ex FFCC Mitre Ramal Tigre y la materialización de las calles correspondientes para los frentistas del sector intervenido. Constituirá una alternativa para los automóviles que actualmente circulan hacia el Este por la calle Ramallo.Reducción  tiempos de viaje y costos a los usuarios de la red evitando inconvenientes y accidentes.  ;LP AUSA 08 2010;2010;Besares con ex FFCC Mitre ramal Tigre entre Grecia y 3 de febrero. Obrador en BN Ibera;Nuñez;13;998;2010-10-14 00:00:00;Ausa;Bajo Nivel Besares;Finalizada en mantenimiento;SES SA Construere ingenieria SA UTE Ibera Besares ;86-Besares_04-10-2012 3.jpg;acceso bajo nivel
AUSA;El cruce bajo nivel calle Ceretti, ex FF Mitre ramal José León Suarez, consiste en la construcción de un nuevo paso vehicular bajo nivel entre la Av. Monroe y la Av. F.D. Roosevelt y calles correspondientes para los frentistas del sector.  Reducción  tiempos de viaje y costos a los usuarios de la red evitando inconvenientes y accidentes.  ;LP AUSA 07 2010;2010;Calle Ceretti con ExFFCC Mitre ramal JLSuarez entre Monroe y Emilio Civit;Villa Urquiza;12;998;2010-10-04 00:00:00;Ausa;Bajo Nivel Ceretti;Finalizada sin recepción provisoria ;Fontana Nicastro SA de Construcciones;52-2013-08 inauguración.JPG;inauguración
AUSA;Remocion de interferencias ferroviarias en Obra BN Ceretti en ejecución. Los materiales serán provistos por el concesionario ferroviario. ;2012 04 0265 00;2013;Calle Ceretti con ExFFCC Mitre ramal JLSuarez entre Monroe y Emilio Civit;Villa Urquiza ;12;998;2013-01-22 00:00:00;Ausa;Bajo Nivel Ceretti Interf Ferroviarias ;Finalizada sin recepción provisoria ;Baires Ferrovial SA ;;
AUSA;Consiste en la ejecución de un cruce vehicular bajo nivel en la Avda Constituyentes  cruce con vías Ex  FFCC  Mitre, Ramal  J L Suárez,  entre calles Olazábal  y Cullen,  en  el  límite de los barrios  de  Villa Pueyrredón y Villa Urquiza,  en  la  zona  noroeste  de  la  Ciudad  de  Buenos  Aires. La obra comprende la vinculación vial de vehículos automotores de tránsito particular y público de la Av.Constituyentes a través de un Paso Bajo Nivel por debajo de las vías del FFCC Mitre evitando la actual intersección con barreras;2013 01 0001 00;2014;Avda de los Constituyentes y Ex FFCC Mitrre Ramal JL Suarez entre Ladines y Griveo ;Villa Urquiza y Villa Pueyrredon ;12;998;2014-01-22 00:00:00;Ausa;Bajo Nivel Constituyentes ;En Ejecucion;Jose F Chediack SA;render.jpg;render 1
AUSA;Contratacion de la provision de equipos materiales y mano de obra necesarios para la realizacion de trabajos de demolicion y desarme de las estructuras pertenecientesa las aprcelas afectadas a la futura obra del PAso Bajo Nivel en la Avda Constituyentes entre Avda Olazabal y Cullen. A medida que la Direccion de Bienes de la Ciudad de BsAS vaya transfiriendo a AUSA las parcelas a intervener se informará a CONTRATISTA quien coordinara con persdonal de AUSA una visita a la zona de los Trabajos.   ;2012 02 0065 00;2013;Avda Constituyentes y ex FFCC Mitre ramal JL Suarez entre Cullen y Olazabal ;Villa Pueyrredon ;12;998;2013-02-25 00:00:00;Ausa;Bajo Nivel Constituyentes Demoliciones ;Neutralizada;Demoliciones y Antiguedades San Telmo SRL;AvConstituyentes 4890.jpg;Constituyentess4890
AUSA;La obra consiste en la construccion de dos nuevos pasos vehiculares bajo nivel, uno en la calle Cuenca, entre Nueva York y Asuncion, y otro en la calle Llavallol entre, Nueva York y Pareja. Se espera que la obra producirá una reducción en los tiempos de viaje y costos a los usuarios de la red evitando inconvenientes y accidentes. ;LP AUSA 09 2010;2010;Cuenca;Agronomía;15;998;;Ausa;Bajo Nivel Cuenca ;Paralizada;Fontana Nicastro SA de Construcciones;;
AUSA;La obra consiste en la construcción de dos nuevos pasos vehiculares bajo nivel, uno en la calle Deheza entre 3 de Febrero y 11 de Septiembre y otro en la calle Quesada entre 3 de Febrero y Arcos. ;LP AUSA 12 2010;2010;Deheza entre 3 de febrero y 11 de septiembre con ex FFCC Mitre Ramal Tigre. ;Nuñez;13;998;;Ausa;Bajo Nivel Deheza;Paralizada;Fontana Nicastro SA Panedile Argentina SAICFI UTE;;
AUSA;La obra consiste en la construccion de un dos nuevos pasos vehiculares, uno en la calle Empedrado bajo las vias del FFCC Gral. San Martin y otro  en la calle Marcos Sastre bajo las vías del FFCC Gral. San Martín. ;LP AUSA 14 2010;2010;;;;998;;Ausa;Bajo Nivel Empedrado;Paralizada;a designar;;
AUSA;La obra consiste en la ejecución de un cruce vehicular bajo nivel doble mano en la calle Iberá. En la actualidad, el paso a nivel es posible solamente en sentido E-O El proyecto contempla la eliminación de las barreras arquitectónicas producidas por las vías férreas, proponiendo medios de paso a bajo nivel tanto vehicular como peatonal.Reducción  tiempos de viaje y costos a los usuarios de la red evitando inconvenientes y accidentes.  ;LP AUSA 08 2010;2010;Iberá con ex FFCC Mitre ramal Mitre entre Grecia y OHiggins Obrador sobre OHiggins;Nuñez;13;998;2010-10-14 00:00:00;Ausa;Bajo Nivel Ibera;Finalizada en mantenimiento;SES SA Construere ingenieria SA UTE Ibera Besares ;61-PBNIbera_11-23.jpg;Tunel ,pintura y tren pasando
AUSA;Cruce vehicular de doble mano bajo las visa del FFCC ambos sentidos de transito de 13.80 mts de ancho de calzada. Rampas ed ingreso y egreso pendiente longitudinal de 8%. Cruce peatonal con pasarelas de escaleras y rampas . Estacion de bombeo pluvial. Metodo constructivo Estructura de tipo PREMOLDEADA y  estructuras ejecutadas in situ. ;Cont 2012 01 002 00 ;2012;Avda Federico Lacroze y ex FFCC Mitre ramales JLSuarez y Mitre entre Conesa y Amenabar;Colegiales ;13;998;2012-10-31 00:00:00;Ausa;Bajo Nivel Lacroze ;En Ejecucion;Jose F Chediack SA;habilitacion transito 10-10-2013.jpg;Habilitacion transito
AUSA;Memoria descriptiva de los trabajos de instalacion de la nueva red. Reacondicionamiento y reubicacion de colectoras cloacales y reubicacion de la red de agua potable. ;2012 04 0237 00;2013;Avda Federico Lacroze y ex FFCC Mitre ramales JLSuarez y Mitre entre Conesa y Amenabar;colegiales;13;998;2012-10-01 00:00:00;Ausa;Bajo Nivel Lacroze AYSA convenio;Finalizada sin recepción provisoria ;AYSA ;;
AUSA;Con motivo de la ejecución por parte de AUSA de la Obra Bajo Nivel de la Avda Lacroze y las vias del FFCC Mitre se hace necesario la reubicacion de las cañerias pertenecientes a la empresa de servicios AYSA cuyo actual emplazamienmto interfiere con el desarrollo de la obra principal. Corrsponde a  Ing de detalle, Gestion y aprobaciones necesarias para completameinto de las obras, provision de materiales, obra civil e instalaciones, control de soldaduras y ejecucion y planos conforme a obra.  ;2012 02 0033 00;2012;Avda F Lacroze cruce FFCC ex linea Mitre ramal JL Suarez entre Conesa y Amenabar ;Colegiales ;13;998;2012-12-03 00:00:00;Ausa;Bajo Nivel Lacroze Cañerias de Agua y CLoacas ;Finalizada sin recepción provisoria ;AMYC Construcciones SRL ;;
AUSA;Remociones para ejecución de BN Lacroze. Obra civil e instalaciones, Provisión de materiales, Realizacion de todas las getiones y obtención de aprobaciones para completamiento del trabajo, rediografia de soldadoras, y prsentacion de planos conforme a obra aprobados por Metrogas.  ;2012 02 0032 00;2012;Avda F Lacroze cruce FFCC ex linea Mitre ramal JL Suarez entre Conesa y Amenabar ;Colegiales ;13;998;2012-10-24 00:00:00;Ausa;Bajo Nivel Lacroze cañerias GAS ;En Ejecucion;CATEGAS SRL ;;
AUSA;Provision de dos empalmes para cable de alta tensión 132KV ejecucion de emplame con equipo especificotraslado de materiales colocacion de conductor cable en los,cañeros ya ejecutados colocacion de arqueta camara de inspeccion para el tendido de fibrea optica a remover incluye excavacion provision  y colocacion de la arqueta premoldeada de tapones de cierres de conductores y equipo Marquer detector electronico de arqueta.  ;2013 04 0223 00;2013;;;;998;2013-10-08 00:00:00;Ausa;Bajo Nivel Lacroze Empalmes;Finalizada sin recepción provisoria ;Kioshi SA;;
AUSA;REm de fibra optica de METROTEL en BN Lacroze;2013 04 0089 00;2013;Avda Federico Lacroze y ex FFCC Mitre ramales JLSuarez y Mitre entre Conesa y Amenabar;Colegiales;13;998;2013-04-11 00:00:00;Ausa;Bajo Nivel Lacroze fibra Optica METROTEL;En Ejecucion;CPS Comunicaciones SA METROTEL  ;;
AUSA;corrsponde a Ingenieria de detalle,obtencion de permisos de ejecución de obra, provision de materiales, obras civiles e instalaciones para realizar un paso a nivel vehicular en calle OLLEROS y FFCC Mitre estaciaone Colegiales  ;2012 02 0020 00;2012;CAlle Olleros y FFCC ex Mitre ramales JLSuarez y Mitre ;Colegiales ;13;998;2012-09-03 00:00:00;Ausa;Bajo Nivel Lacroze Olleros Paso a nivel Provisorio;Finalizada con recepción provisoria;Baires Ferrovial SA ;1 - IMG_0108.JPG;2013ENE03-4
AUSA;Trabajos a eralizar para la Remoción de interferencias de EDENOR en el paso Bajo Nivel de la Avda Lacroze y vias del FFCC Mitre ;2013 04 0088 00;2013;Avda Federico Lacroze y ex FFCC Mitre ramales JLSuarez y Mitre entre Conesa y Amenabar;colegiales;13;998;2013-07-01 00:00:00;Ausa;Bajo Nivel Lacroze Rem EDENOR ;Finalizada sin recepción provisoria ;EDENOR SA;;
AUSA;Provision de 24 mts caño PEAD de 450mm y 72 mts de caño PED 160mm segun oferta de 10 de julio de 2013 para remociones de interferencias de EDENOR   ;2013 04 0129 00;2013;Av.F.Lacroze y ex FFCC Mitre ramales JLSuarez y Mitre entre Conesa y Amenabar;Colegiales;13;998;2013-07-15 00:00:00;Ausa;Bajo Nivel Lacroze Tunel Rem EDENOR;Finalizada sin recepción provisoria ;Protunel SA;;
AUSA;La obra consiste en la construcción del Paso Bajo Nivel de la Av C Larralde que forma parte del sistema de cruces bajo nivel de vías en trinchera en los cruces de la calle M. Pedraza y Av. C. Larralde y las vías del FFCC TBA, ex Mitre Ramal Tigre. Será de uso para tránsito liviano y transporte público. Con objeto de integracion vecinal y reducción en tiempo de viaje y costos, evitando inconvenientes y accidentes.;4122 GCBA Tras;2007;Av. Crisologo Larralde al 1900 y vías del FFCC Mitre;Nuñez;13;998;2010-10-04 00:00:00;Ausa;Bajo Nivel Larralde;Finalizada recepción provisoria parcial;Fontana NicastroSA Construere SA UTE Ped Larralde;90-Inauguración.jpg;90-Inauguración
AUSA;La obra consiste en la construccion de dos nuevos pasos vehiculares bajo nivel, uno en la calle Cuenca, entre Nueva York y Asuncion, y otro en la calle Llavallol entre, Nueva York y Pareja. Se espera que la obra producirá una reducción en los tiempos de viaje y costos a los usuarios de la red evitando inconvenientes y accidentes. ;LP AUSA 09 2010;2010;LLavallol;Agronomia;15;998;;Ausa;Bajo Nivel Llavallol;Paralizada;Fontana Nicastro SA de Construcciones;6  LAvallol.jpg;Lavallol
AUSA;La obra consiste en la construcción de un dos nuevos pasos vehiculares, uno en la calle Empedrado bajo las vías del FFCC Gral. San Martín y otro  en la calle Marcos Sastre bajo las vías del FFCC Gral. San Martín. ;LP AUSA 14 2010;2010;;;;998;;Ausa;Bajo Nivel Marcos Sastre;Paralizada;a designar;;
AUSA;La obra consiste en la construcción de un cruce bajo nivel de vías en trinchera en el cruce de la Avenida Monroe y las vías del FFCC TBA (ex Mitre). El cruce de la Av. Monroe contará con 2 carriles vehiculares de 3,50 m, gálibo mínimo de 4,20m y dos veredas peatonales a nivel de calzada de 5,80 m y 6,00 m de ancho. El puente ferroviario es de 3 tramos (8,50 m + 18,60 m + 8,50 m). Serán de uso para tránsito liviano y transporte de pasajeros.;41121 GCBA Traspaso;2006;Monroe entre Naon y Avda Melian ;Coghlan;12;998;2010-09-15 00:00:00;Ausa;Bajo Nivel Monroe ;Finalizada con recepción provisoria;Fontana Nicastro SA Luciano UTE ;90Inauguraciondic11.jpg;inauguración
AUSA;La obra consiste en la ejecución del proyecto de detalle y construcción del cruce bajo nivel del Av. Mosconi con vías del ex FFCC Urquiza, explotado actualmente por Metrovías SA. Las tareas incluyen la instalación de nuevas cañerías de agua y de gas. El objeto es larducción tiempos de viaje y costos a los usuarios de la red evitando inconvenientes y accidentes.;45059 GCBA Traspaso;2006;Av Mosconi con vías FFCC Ex Urquiza entre Segurola y Gualeguaychu;Devoto;11;998;2010-05-17 00:00:00;Ausa;Bajo Nivel Mosconi;Finalizada recepción definitiva;IECSA SA;92-05-11-Habilit tránsito vehic túnel.JPG;92-05-11-Habilit tránsito vehic túnel.JPG
AUSA;La obra consiste en la construccion de dos nuevos pasos vehiculares, uno en la calle Varela bajo las vias del FFCC Gral. San Martin y otro en la calle Navarro bajo las vias del FFCC Gral. San Martin;LP AUSA 13 2010;2010;Navarro y ex FFCC SAN MArtin interseccion Gutierrez y JV Gonzalez y Gutierrez y San Nicolas  ;Agronomía;15;998;;Ausa;Bajo Nivel Navarro;Paralizada;a designar;navarro varela modificado.jpg;Render vista proyecto
AUSA;OLAZABAL - SUPERI La obra consiste en la apertura del terraplén ferroviario y construcción de un cruce bajo nivel de vías en el cruce de la Avenida Olazábal y las vías del FFCC TBA (ex Mitre) y la rectificación del cruce de la calle Superí y las vías del FFCC TBA (ex Mitre). El cruce de la Av. Olazábal contará con un ancho de calzada de 10,98 m, gálibo mínimo de 3,30m y dos veredas peatonales a nivel de calzada de 5,80 m y 6,00 m de ancho. El puente ferroviario es de 3 tramos (8,50 m + 18,60 m + 8,50 m). El cruce de la calle Superí contará con un ancho de calzada de 11,70 m, gálibo mínimo de 3,60m y dos veredas peatonales a nivel de calzada de 3,00 m de ancho. El puente ferroviario es de 3 tramos (8,50 m + 18,60 m + 8,50 m). Serán de uso para tránsito liviano y transporte de pasajeros. ;41121 GCBA Traspaso;2012;Olazabal con FFCC Mitre ramal JLSuarez entre Superi con Urtubey y Avda Melian y Superi entre Olazabal y Mendoza;Belgrano;13;998;2012-06-29 00:00:00;Ausa;Bajo Nivel Olazabal Superi;Finalizada sin recepción provisoria ;Fontana Nicastro SA Luciano UTE ;Olazabal Inauguracion.jpg;Inauguracion Olazabal
AUSA;Remocion de interferencias ferroviarias en Obra BN Olazabal Superi en ejecución. Los materiales serán provistos por el concesionario ferroviario. ;2012 04 0267 00;2013;Olazabal con FFCC Mitre ramal JLSuarez entre Superi con Urtubey y Avda Melian y Superi entre Olazabal y Mendoza;Belgramo;13;998;2013-01-22 00:00:00;Ausa;Bajo Nivel Olazabal Superi Interf Ferroviarias ;Finalizada sin recepción provisoria ;Baires Ferrovial SA ;;
AUSA;Mosaiquismo y herreria artistica segun espacificaciones tecnicas de licitacion y ofeta de 23 de sept 2013 ;201302 0059 00;2013;;;;998;2013-10-15 00:00:00;Ausa;Bajo Nivel Olazabal Superi Mosaiquismo ;Finalizada sin recepción provisoria ;Storey Guillermo;;
AUSA;La obra consiste en la construcción de un nuevo paso vehicular, en la calle Pacheco bajo las vías del ex FFCC Mitre (Ramal J. L. Suarez) ;LP AUSA 15 2010;2010;CAlle PAcheco y ex FFCC Mitre Ramal JLSuarez y CAlles Roosevelt F;Villa Urquiza;12;998;2012-08-13 00:00:00;Ausa;Bajo Nivel Pacheco ;Finalizada sin recepción provisoria ;UTE EleprintSA Construere Ing SA ;67-Pacheco_13-08_inaug 03.jpg;acceso tunel, inauguración
AUSA;Remocion de interferencias ferroviarias en Obra BN Pacheco en ejecución. Los materiales serán provistos por el concesionario ferroviario. ;2012 04 0266 00;2013;CAlle Pacheco y ex FFCC Mitre Ramal JLSuarez y CAlles Roosevelt F;Villa Urquiza ;12;998;2013-01-22 00:00:00;Ausa;Bajo Nivel Pacheco Interf Ferroviarias  ;Finalizada sin recepción provisoria ;Baires Ferrovial SA ;;
AUSA;Diseño provision y colocacaion de mosaiquismo y rtabajos de pintua artistica para el paso bajo nivel Pacheco ;2013 02 0039 00;2013;Calle Pacheco y ex FFCC Mitre ramal J.L.Suarez y calle Roosvelt;Villa Urquiza;12;998;2013-09-06 00:00:00;Ausa;Bajo Nivel Pacheco Pintura Artistica;Finalizada sin recepción provisoria ;Storey Guillermo;PBNPacheco_08.09.JPG;Mosaicos en paredes tunel Pacheco
AUSA;La obra consiste en la construcción del Paso Bajo Nivel de la calle Manuela Pedraza que forma parte del sistema de cruces bajo nivel de vías en trinchera en los cruces de la calle M. Pedraza y Av. C. Larralde y las vías del FFCC TBA, ex Mitre Ramal Tigre. Será de uso para tránsito liviano y transporte público. Con objeto de integracion vecinal y reducción en tiempo de viaje y costos, evitando inconvenientes y accidentes.;4122 GCBA Tras;2010;Manuela Pedraza entre OHiggins y Grecia ;Nuñez;14;998;2010-10-04 00:00:00;Ausa;Bajo Nivel Pedraza;Finalizada recepción provisoria parcial;Fontana NicastroSA Construere SA UTE Ped Larralde;90-DSC_0907.JPG;90-Inauguración Pedraza
AUSA;La obra consiste en la construcción de dos nuevos pasos vehiculares bajo nivel, uno en la calle Deheza entre 3 de Febrero y 11 de Septiembre y otro en la calle Quesada entre 3 de Febrero y Arcos. ;LP AUSA 12 2010;2010;Quesada y ex FFCC Mitre Ramal Tigre entre 3 de febrero y Arcos ;Nuñez;13;998;;Ausa;Bajo Nivel Quesada;Paralizada;Fontana Nicastro SA Panedile Argentina SAICFI UTE;;
AUSA;Ejecución de un cruce vehicular bajo nivel en la Avenida San Martín  en  su  cruce  con  las vías del  FFCC  Urquiza,  entre las calles Pareja  y Asunción,  en el límite entre los barrios de Villa Devoto, Villa Pueyrredón y Agronomía, en la zona Noroeste de la Ciudad de Buenos Aires. Comprende la vinculación vial de vehículos automotores de tránsito particular,  público y un importante volumen de  vehículos pesados que circulan por  la Av. San Martín a través de un Paso Bajo Nivel por debajo de las vías del FFCC Urquiza. Evitará la actual intersección con barreras. Dicha obra permitirá una circulación más fluida y segura tanto de los vehículos como del ferrocarril en una arteria fundamental para el tránsito de la Ciudad de Buenos Aires ;2013 01 0005 00;2013;Avda San Martin y FFCC Urquiza entre calles PAreja y Asuncion ;Villa DEvoto Villa Pueyrredon y Agronomía;11;998;2014-01-17 00:00:00;Ausa;Bajo Nivel San Martín ;En Ejecucion;Fontana Nicastro Martinez y de la Fuente SA UTE;SAM_0098.JPG;Cruce a nivel actual
AUSA;Construcción de una paso bajo nivel en la Av. Sarmiento, eliminando así un foco de congestión (principalmente en horarios pico) y de accidentes. Además está prevista la ejecución de ramas de acceso egreso desde y hacia la AU Illia.;38810;2004;Av. Sarmiento y vías del FFCC Gral. Belgrano;Palermo;14;998;2006-10-25 00:00:00;Ausa;Bajo Nivel Sarmiento;Finalizada recepción definitiva;Jose Cartelone Construcciones Civiles SA;Bajo Nivel Sarmiento 1.jpg;Aerea Sarmiento
AUSA;Consiste en la ejecución de un cruce vehicular bajo nivel sobre la calle Soler, entre las calles Godoy Cruz y Juan B. Justo, en su intersección con las vías del FFCC San Martín con la consecuente reducción  tiempos de viaje y costos a los usuarios de la red evitando inconvenientes y accidentes. ;LP AUSA 06 2010;2010;Soler entre Avda Juan B Justo y calle Godoy Cruz bajo vias FFCCSan Martin;Palermo;14;998;2010-12-07 00:00:00;Ausa;Bajo Nivel Soler;Finalizada recepción definitiva;JOSE CARTELLONE CC SA;Soler-apertura-03.jpg;BNSoler4julio11
AUSA;La obra consiste en la construccion de un nuevo paso vehicular, en la calle Varela bajo las vias del FFCC Gral. San Martin ;LP AUSA 13 2010;2010;Calle Varela Jose Pedro y ex FFCC San Martín intercepcion Gutierrez con Lamarca y Gutierrez y San Nicolas;Agronomía;15;998;;Ausa;Bajo Nivel Varela;Paralizada;a designar;navarro varela modificado1.jpg;Render Varela vista 1
