tipo;descripcion;expediente;anio_expediente;domicilio;barrio;comuna;unidad_ejecutora;fecha_inicio;area;obra;estado_obra;contratista;foto_nombre;foto_descripcion
ARQ;Se trata de 2 manzanas situadas en el barrio de Villa Soldati, entre las calles Valparaíso, Veracruz y Maracaibo, frente al gran conjunto habitacional homónimo, pero dentro de un tejido de construcciones de media y baja densidad, de 1 y 2 plantas de altura, con importante presencia de terrenos baldíos. La carencia de plazas en este barrio es notoria. Una de las 2 manzanas es de planta irregular con espacios públicos disponibles en 2 de sus esquinas, actualmente en desuso, y con sectores de amplias veredas sin solados, utilizados a menudo como improvisados depósitos de residuos domiciliarios. La otra manzana, de planta triangular y más pequeña, adyacente y separada de la anterior por una calle de escaso tránsito automotor, es pública en su totalidad y aunque hoy no posee equipamiento alguno exceptuando un poste de iluminación , es utilizada espontáneamente por los niños del barrio como campo de juegos. La presencia Premetro constituye un dato importante del sitio, es el principal medio de transporte público de la zona y la traza de sus vías pasa por las calles Valparaíso y Veracruz, con una parada en la intersección de las mismas. Los coches tienen una frecuencia alta, y producen situaciones de riesgo al pasar junto al espacio de juegos de los niños.;1022031;2012;;;;312;2013-01-28 00:00:00;Arquitectura;Plazoletas Valparaiso, Veracruz y Maracaibo;Acta de Inicio;CUNUMÍ SA;;
ARQ;El edificio se identifica como un bloque que está interrumpido por una pasante peatonal que permite pasar desde la calle al interior del conjunto . El frente d ela calles Galvan se completa con la escuela infantil, separadas por una calle que admite la continuidad virtual de la calle y evita la sensación de muralla, incorporando de esta manera las vistas del transeúnte y el recorrido por el interior de la plaza del complejo.  El partido arquitectónico adoptado responde al tradicional de patio claustro, en este caso rectangular, en torno del cual se desarollan los programas de necesidades de cada una de las escuelas, quedando claramente diferenciadas las áreas de usos compartidos, restringidos y de servicion. ;207.554;2012;;;;312;2013-06-24 00:00:00;Arquitectura;POLO EDUCATIVO SAAVEDRA-ESCUELA ESPECIAL N 1;Acta de Inicio;CRIBA SA;;
ARQ;Puesta en valor del sector, mejoramiento del espacio publico. Nivelación de aceras y calzadas para favorecer la peatonalización;24957;2008;calles Vicente López Pacheco de Melo Libertador General San Martín Presidente Quintana Presidente R.M.Ortiz Azcuénaga y Eduardo Victor Haedo;Recoleta;2;312;2008-12-15 00:00:00;Arquitectura;Recoleta;Finalizada recepción definitiva;CUNUMÍ SA;;
ARQ;Incluido dentro del programa AREA CENTRAL del Plan Urbano Ambiental, hoy denominado Prioridad Peatón.   Corresponde a la Segunda Etapa de intervención que comprende la calle Reconquista desde la Av. Córdoba hasta la Av. Corrientes. El área tiene características netas del centro de la Ciudad donde se alternan los usos de oficinas, actividad bancaria, hoteles, edificios de administración público y baja presencia residencial.  ;24973;2008;Reconquista entre Av. Córdoba y Av. Corrientes;San Nicolás;1;312;2008-11-03 00:00:00;Arquitectura;Reconquista Tramo II - entre Av. Córdoba y Av. Corrientes ;Finalizada recepción definitiva;Paleco SA ;;
ARQ;Calle Reconquista entre Avda Corrientes y Avda Rivadaria Puesta en valor del sector mejoramiento del espacio publico Nivelacion de aceras y calzadas utilizanzándose la baldosa granítica como material preponderante creándose una calle de transito vehicular restringido lo que permite favorecer la peatonalizacion de la misma;24941;2008;Reconquista entre Rivadaria y Corrientes ;Monserrat;1;312;2008-12-30 00:00:00;Arquitectura;Reconquista Tramo III;Finalizada recepción definitiva;Salvatori SA Parques y Jardines;;
ARQ;En función de los objetivos de puesta en valor del sector y mejoramiento  del espacio público técnicamente consiste en la nivelación de aceras y calzadas reconstrucción de cordones incorporación de arbolado equipamiento urbano y nuevas luminarias El material preponderante será la baldosa granítica que permitirá crear una calle de tránsito vehicular restringido para favorecer la peatonalización de la misma ;3880;2008;Calle Reconquista entre Cordoba y Ricardo Rojas;Monserrat;1;312;2008-07-28 00:00:00;Arquitectura;Reconquista Tramo l;Finalizada recepción definitiva;Salvatori SA Parques y Jardines;;
ARQ;La presente obra tiene por objeto la reparación de las cubiertas del Deposito de Sastrería del Teatro San Martin de la calle Gregoria Pérez 3637, del Barrio de Chacarita (CABA) NRO ORDEN DE COMPRA A CONFIRMAR.  OBRA EN PROCESO DE ADJUDICACION. ;437027;2013;Gregoria Perez 3637;Chacarita;15;312;2013-07-10 00:00:00;Arquitectura;Reparacion Cubierta Deposito Gregoria Perez;Acta de Inicio;DYMA SA;Foto 2.bmp;Foto 2
ARQ;Esta obra se inscribe dentro de un plan general de rehabilitación del conjunto edilicio del TGSM. Comprende la renovación integral de las cubiertas y la restauración y-o renovación de toda su envolvente vertical, fachadas interiores y medianeras, a excepción de las carpinterías.;2222619-2012;2012;Av. Corrientes 1530;San Nicolas;1;312;2013-03-12 00:00:00;Arquitectura;Reparación Integral de cubiertas y revestimientos exteriores. TGSM;Acta de Inicio;Conorvial SA;TGSM -1.jpg;TGSM
ARQ;Puesta en valor del sector y de su espacio público revertir el deterioro y degradación portenciar el proceso de recuperación y mejoramiento de las condiciones ambientales El proyecto produce los cambios necesarios para incorporar esta vía a la ley de accesibilidad atenua el impacto que el tránsito vehicular produce en la circulación de su actor más recurrente que es el peatón ;24950;2008;Rivadavia e Hipolito Yrigoyen entre CPelegrini y Bolivar;Monserrat;1;312;2008-10-22 00:00:00;Arquitectura;Rivadavia e Hipolito Yrigoyen Etapa I;Finalizada recepción definitiva;CUNUMÍ SA;;
ARQ;Puesta en valor del sector y de su espacio público revertir el deterioro y degradación potenciar el proceso de recuperación y mejoramiento de las condiciones ambientales El proyecto produce los cambios necesarios para incorporar esta vía a la ley de accesibilidad atenúa el impacto que el tránsito vehicular produce en la circulación del peatón Cambios de materiales y de dimensiones para cumplir condiciones de accesibilidad para todos. Incorporación de cestos y bolardos;30832;2008;Rivadavia e Hipolito Yrigoyen entre Lima y LSaenz Peña;Montserrat;1;312;2008-12-12 00:00:00;Arquitectura;Rivadavia e Hipolito Yrigoyen Etapa II ;Finalizada recepción definitiva;ALTOTE SA;;
ARQ;Esta Obra se inscribe dentro de un plan general de puesta en valor del conjunto edilicio del Teatro San Martín, ubicado en la Av. Corrientes 1530. Este Teatro forma un todo edilicio conjuntamente con el Centro Cultural San Martín, con acceso desde calle Sarmiento. Desde esta calle se realizará el ingreso de materiales y personal para la obra objeto de esta Licitación. La contratación incluye la ejecución de todos los trabajos que, aunque no se detallen, sean necesarios para el fin propuesto, cumpliendo en lo técnico con las reglas del arte de la construcción y en lo reglamentario con las disposiciones vigentes. La Contratista deberá presentar el Cronograma de trabajos en los cuales se vea reflejada esta organización, y coordinará junto con la Inspección de Obra las fechas de finalización de cado uno de los sectores. La obra incluye construcción de un nuevo volumen, el cual se ejecutará con obra seca, para albergar dos nuevas salas de ensayo para el Ballet Contemporáneo del Teatro San Martin.;2407521;2013;Corrientes 1500;San Nicolas ;1;312;2013-11-18 00:00:00;Arquitectura;Sala de Ensayos del Teatro San Martín;En Ejecucion;Conorvial SA;;
ARQ;Ejecución de 40 unidades habitacionales. Espacio Público, veredas, calles de convivencia, parque lineal con forestación y equipamiento.;472885;2010;Virrey del Pino y Donado;Villla Ortuzar;15;308;2010-12-17 00:00:00;Arquitectura;Soluciones Habitacionales Barrio Parque Donado Holmberg;En Ejecucion;EMACO SA;DonadoPMPvrcam03HW.jpg;Perspectiva
ARQ;40 unidades habitacionales;925239;2010;;;;308;2012-01-04 00:00:00;Arquitectura;Soluciones habitacionales Barrio Parque Donado Holmberg II;En Ejecucion;EMACO SA;;
ARQ;La Obra consiste en desarrollar un proyecto integral, cuyo diseño debera prever la ejecucion de 40 unidades habitacionales de 2 y 3 ambientes.  ;122433;2011;;;;312;2012-09-20 00:00:00;Arquitectura;Soluciones Habitacionales Barrio Parque Donado Holmberg III Seccion 51 Manzana 103 Parcela 1G;Acta de Inicio;WAYRO INGENIERIA SA ;Exterior Cam1.jpg;Donado 3 Frente
ARQ;El objetivo general es la puesta en valor del sector, la optimización del espacio público y un desarrollo paisajístico-funcional que posibilite actividades de esparcimiento y recreación. Incorporar un medio de transporte ecológico, no contaminante y sustentable, como es la bicicleta. Se materializan a nuevo las veredas. La calle mantendrá su perfil de calzada actual, la ciclovía se pintará sobre el asfalto existente. Tendrá 2 metros de ancho y será de doble mano en toda su extensión. En el espacio sobrante de la calzada actual, se incorporará equipamiento, iluminación y árboles de pequeño porte. Se demarcarán en piso cruces de esquinas, sendas peatonales, accesos a garaje, estacionamiento turístico y toda la demarcación correspondiente en carriles de ciclovías.;1418833;2009;Suipacha desde Av. Sta Fé hasta Rivadavia y calle Tacuarí desde Rivadavia hasta Av. de Mayo;San Nicolas y Retiro;1;312;2010-07-27 00:00:00;Arquitectura;Suipacha - Etapa 1;Finalizada recepción definitiva;CUNUMÍ SA;chica228.JPG;Suipacha entre B.Mitre y Av. Rivadavia
ARQCU;Adecuacíon de una sector del Parque para la realización de eventos culturales masivos. Ejecución de cerco de seguridad y portones para evacuación de emergencia. Infraestructura eléctrica para los eventos, alumbrado público general y perimetral e instalaciones sanitarias y pluviales. Puesta en valor de equipamento existente y plantación de 500 árboles y arbustos.;1304107;2012;;;;2303;2013-03-06 00:00:00;Arquitectura Cultura;BUENOS AIRES ROCK;Acta de Inicio;TEXIMCO SA DAL CONSTRUCCIONES SA UTE;;
ARQCU;Restauración y puesta en valor de la ex-usina de la CIAE. Construcción de una sala de conciertos para música sinfónica para 1250 personas, una Sala de Música de Cámara para 350 espectadores, una Sala de exposiciones (Salón Dorado) e instalaciones complementarias (camarines, oficinas administrativas, sanitarios, confitería, boletería, etc). Las tareas incluyen demolición de estructuras de hormigón armado existentes. Remoción total de cubiertas metálicas, retiro, refuerzo y reubicación de cerchas metálicas existentes, para recibir una nueva cubierta en ambas naves, asegurando la insonorización del edificio. Ejecución de todas las estructuras de sostén metálicas y en hormigón armado en sala de ensayos, sala de cámara y sala sinfónica, escaleras y construcciones complementarias, pasarelas, bandejas laterales y circulaciones verticales. Realización de tareas de albañilería y de detalle, y terminaciones y revestimientos interiores de tres salas destinadas a la ejecución musical, incluyendo acondicionamiento acústico, ejecución del maderamen de plateas, provisión y colocación de butacas y realización de revestimientos acústicos de madera en cielorrasos, antepechos de palcos y plateas.;75742;2004;Av.Pedro de Mendoza 539,531entre Benito Pérez Galdós y A.Caffarena;La Boca;4;524;2007-07-04 00:00:00;Arquitectura Cultura;Ciudad de la Música ;En ejecucion sin certificacion mensual;CAPUTO SAICyF;DSC06523.JPG;Salon dorado - Maqueta capital federal
ARQCU;El proyecto de Remodelacion y Ampliacion de la sede del Museo de Arte Moderno, ubicado en la Av. San Juan 350, se compone de tres bloquos edilicios. El original, ocupado por la antigua fabrica tabacalera de Nobleza Picardo, cuyas instalaciones ya contenian al MAMBA, que mantiene las salas de exhibicion originales y amplia depositos y talleres de trabajo internos.  Otro que conforma una construccion nueva adosada en el terreno contiguo sobre Av. San Juan. En cuyo interior se mantienen los cimientos orginales de la Casa del Naranjo (una de las mas antiguas de la ciudad) y que contendra un auditorio equipado para todo tipo de actividades multimedia, con 3 nuevas salas de exhibicion en los pisos superiores y 2 depositos subterraneos paralelos a la autopista 25 de Mayo.  El tercer sector lo constituye el Pabellon internacional, ubicado en el lote del ex. Museo del Cine, con salida a calle Defensa, que sera destinado a las actividades de exhibicion y capacitacion a programar por el Ministerio de Cultura. Quedando las oficinas adminitrativas del complejo en el sector de azoteas.;13123;2006;Avda San Juan 350;San Telmo;1;524;2008-08-26 00:00:00;Arquitectura Cultura;MAMBA;Neutralizada;UTE Bricons SAICFI Emaco SA;DSC04092.JPG;inauguracion dic-10 escalera escultorica
ARQED;Ante los requerimientos del personal del Hospital Pirovano, de la comunidad en general y coincidiendo con los objetivos del GCBA de revitalizar desde la educación el desarrollo de este área de la Ciudad Autónoma de Buenos Aires se ejecutó el presente proyecto consensuado con las diferentes áreas educativas y con padres de los niños asistentes al establecimiento y de la comunidad en general. El edificio albergará una población de bebés y niños desde 45 días a 5 años de edad. Contempla salas para lactantes, deambuladores, dos, tres, cuatro y cinco años;1093099-2010;2010;;;;558;2011-09-13 00:00:00;Arquitectura Educacion;Construcción Escuela Infantil N 6 D.E N 10 BLANCO ENCALADA;En Ejecucion;CUNUMÍ SA;Escuela Nº6-01.JPG;FACHADA
ARQED;El edificio que alberga una escuela media escuela de danzas folklore y teatro cuenta con una superficie cubierta de 8548 m2 sobre un terreno de 4575 m2 ubicado en la calle Fonrouge 711,barra inclinada, 735 entre Ercilla y Ulrico Schmidl. Este edificio consta de planta baja y cuatro pisos desarrollados en un volumen longitudinal  paralelo a Fonrouge  y con acceso principal sobre esta calle El esquema arquitectónico es de circulación central  con aulas laterales sobre la calle y sobre el patio interno  Sobre esta circulación se desarrollan dos escaleras también  longitudinales con iluminación cenital a través de sendas claraboyas  Las escaleras de escape contra incendio y los ascensores conforman 2 cajas verticales  cerradas sobre Fonrouge enfrentadas circulación de por medio a los núcleos sanitarios;73001;2005;Fonrouge entre Ercilla y Schmidl Ulrico;Liniers;9;558;2008-06-01 00:00:00;Arquitectura Educacion;Escuela de Danzas N 1 DE 20;Finalizada recepción provisoria parcial;Bricons SAICFI;SANY0003.JPG;Frente de la Escuela
ARQED;Demolición total del edificio existente. Construcción de un nuevo edificio dividido en dos volúmenes. El primero sobre la línea municipal consta de planta baja y cinco niveles (aulas , talleres, biblioteca y SUM). El segundo volúmen sobre la medianera izquierda consiste en planta baja y dos niveles (gobernación y aulas).;1340046;2010;;;;558;2011-05-12 00:00:00;Arquitectura Educacion;Escuela Media N7 - Maria Claudia Falcone;En Ejecucion;VIDOGAR CONSTRUCCIONES SA;SAM_2682.JPG;Mampostería en los niveles 1 y 2
ARQED;La escuela de educación especial se emplaza en un lote de 30m de frente por 90m de profundidad, en el Barrio Villa Soldati. Debido a los problemas de diferente características que presenta el establecimiento, el proyecto que se plantea desde la Arquitectura es, una tipología de edificio en peine, cocido por una circulación principal, que separa y a su vez relaciona las áreas de aulas ,con sus expansiones descubiertas, de los espacios comunes.;1.340.056;2010;;;;558;2011-04-07 00:00:00;Arquitectura Educacion;Escuela N 7 D E N19 JUAN XXIII Mariano Acosta 2936;En Ejecucion;CUNUMÍ SA;juan 23 s.jpg;Fachada
ARQED;En la concepción de la escuela del futuro, es imprescindible la integración de la misma con la comunidad. La escuela toma así un rol participativo, abriendose hacia el espacio público. La propuesta pretende entonces hacer hincapié en estos aspectos, generando en planta baja un gran planchon en donde se producen los accesos al conjunto escolar, integrando de esta manera a la escuela infantil, primaria e instituto. Allí se ubican todas la funciones compartidas por las escuelas, vinculando de esta forma el patio cubierto, patio descubierto, SUM, biblioteca, centro de medios, talleres, servicios comunitarios y espacios verdes. El diseño de esta planta posibilita también el uso de dichas funciones por la gente del barrio o de toda la comunidad, invitando a la entrada y ofreciendose a los vecinos como un espacio verde mas.;914412;2013;;;;300;2013-12-02 00:00:00;Arquitectura Educacion;Escuela Siglo XXI;En Ejecucion;CRIBA SA;;
ARQED;La parcela existente  -Sección 42- Manzana 009- Parcela 028A-  tiene una superficie de 2708m2 con un frente de 32.38m sobre Av. Juan B. Alberdi y una profundidad variable entre 81.30m. y 86.20m. La zonificación es R2aII. Teniendo como principal condicionante la posición central en el terreno del inmueble histórico a conservar,  se adopta un partido en el cual se concentrará la mayor superficie del programa en un edificio ubicado por detrás del histórico que oficiara de nuevo telón de fondo y albergara la totalidad de las aulas, biblioteca, vivienda del encargado.  En el edificio catalogado se ubicarán las áreas administrativas. Desde el punto de vista arquitectónico se produciría un contrapunto entre la imagen histórica del edificio a conservar y la imagen contemporánea del nuevo edificio, sería esta situación de contraposición la que pondría en relieve el Edificio catalogado funcionando como un telón neutro que no competirá con la arquitectura del edificio protegido. El Edificio de aulas contara con un desarrollo de Subsuelo, Planta baja y 4 pisos, o sea 5 pisos sobrerasante, la terraza se utilizará como área de deportes al aire libre, se propone una estructura liviana y malla de protección. Las áreas de expansión exteriores se encontrarán a nivel de primer subsuelo en relación con el nuevo edificio de aulas y a nivel de planta baja en el Patio de Acceso, además del área de deportes ubicada en la terraza del nuevo edificio. ;310681;2011;;;;558;2012-09-20 00:00:00;Arquitectura Educacion;Escuela Tecnica Nro. 5 D.E. Nro. 11 - Remedios E. de San Martin.;Acta de Inicio;TEXIMCO SA;;
ARQSA;Remodelación Integral, con provisión de materiales, equipamiento integral y mano de obra especializada. Interviniendo los pabellones 1 2 4 5 y 6, totalizando una superficie aprox de 6550 m2. Incluye obras exteriores. El edificio contará con 100 camas para internación, y servicios de terapia ocupacional, rehabilitación y hospital de día.;44427;2004;Av. Warnes 2650 ;Paternal;15;408;2008-08-01 00:00:00;Arquitectura Salud;Hospital Alvear;TRASPASO Obra a Ministerio correspondiente ;MEJORAMIENTO HOSPITALARIO SA;;
ARQSA;Remodelacion Integral del Pabellon 4, incluyendo los trabajos completos de la Red de Gas en todos los Pabellones y red externa, independizando al Hospital de la conexion del Hogar San Martin. ;44427;2004;Av. Warnes 2650;Paternal;15;408;2010-03-08 00:00:00;Arquitectura Salud;Hospital Alvear II;TRASPASO Obra a Ministerio correspondiente ;MEJORAMIENTO HOSPITALARIO SA;;
ARQSA;La obra comprende la Renovación Integral para una superficie total de 5740 m2, correspondiente a la Planta Baja, Primero, segundo y tercer piso, con la provisión de materiales, equipos y mano de obra especializada. El edificio contará con 90 camas de prealta y todos los servicios relacionados con la terapia ocupacional y rehabilitación incluyendo los servicios de hospital de noche (12 camas) y hospital de dia.;8952;2004;Doctor Ramón Carrillo 375;Barracas;4;408;2005-08-19 00:00:00;Arquitectura Salud;Hospital Borda Pabellon 25A;TRASPASO Obra a Ministerio correspondiente ;Bricons SAICFI;;
ARQSA;La Obra comprende la renovación Integral con una superficie de 5.355 m2 del pabellón Amable Jones con la provisión de la totalidad de los materiales, equipos, herramientas y mano de obra especializada, para concluir los trabajos de acuerdo a su fin. Abarca servicios de internación en primer y segundo piso para 97 camas, un centro de exposiciones en planta baja mas el deposito general del hospital en subsuelo.;62078;2004;Doctor Ramón Carrillo 375;Barracas;4;408;2006-03-18 00:00:00;Arquitectura Salud;Hospital Borda Pabellon Amable Jones;TRASPASO Obra a Ministerio correspondiente ;SES SA;;
ARQSA;Consiste en la realización de tareas para la renovación integral y puesta al día de una obra inconclusa comenzada en la década del 70 con una superficie de 6300m2. Comprende la intervención en sectores con diferente estado de avance para los Servicios de Terapia Intermedia e Intensiva Adultos, Servicios Unidad Coronaria, Servicios Terapia Pediátrica con un total de 62 camas todos ellos del primer piso. El segundo piso del C.M.C. (Centro Medico Complementario), esta destinado al Servicio de Internación de Cuidados Especiales contando con un total de 54 camas. El tercer, cuarto y quinto piso pertenecen al Centro Medico Quirúrgico, y cuenta con 90 camas. Incluye la provisión el equipamiento integral, instalaciones de gases medicinales, terminación de núcleos de escalera, puesta en marcha de siete ascensores, la pintura y revestimiento, nuevos parasoles de las fachadas E, O y S.;80381;2006;Diaz Velez 5044;Caballito;6;408;2008-09-15 00:00:00;Arquitectura Salud;Hospital Durand;TRASPASO Obra a Ministerio correspondiente ;RIVA SA;SANY0937.JPG;Sala de Terapia
ARQSA;Remodelación Integral con la provisión de equipamiento integral. Consta  de 60 camas para pacientes y locales de apoyo distribuidos en Pb y 1er piso. mas un Subsuelo para usos complementarios.;70393;2005;brandsen 2570;barracas;4;408;2007-03-15 00:00:00;Arquitectura Salud;Hospital Moyano Pab Santa Rosa;TRASPASO Obra a Ministerio correspondiente ;PLANOBRA SA;;
ARQSA;Remodelación y reacondicionamiento, incorporando adecuaciones funcionales, modificación de accesos, redistribución de áreas, generación de nuevos espacios, provisión de equipamientos específicos, modernización y saneamiento integral del edificio. Se alojarán un total de 388 pacientes para internación, con salones de terapias ocupacionales, comedores, áreas de estar, consultorios, oficinas, áreas para personal médico, servicios y de enfermería. En subsuelo, se incorporará el lavadero central del hospital.;37816;2005;brandsen 2570;barracas;4;408;2007-03-01 00:00:00;Arquitectura Salud;Hospital Moyano Pab Velez Sarfield ;Neutralizada;SEHOS SA;DSCN2946.jpg;Servicios generales
ARQSA;Consiste en la construcción de un edificio destinado al Servicio de Urgencias, superficie cubierta aprox. 1005 m2, más los espacios exteriores semicubiertos y abiertos. Incluye sistema de aire acondicionado e instalaciones de gases medicinales.  El servicio se desarrolla en una planta baja, contando con Sala de Espera, 7 Consultorios de Guardia, 2 salas de procedimientos, 2 salas de aislados, 1 Sala de Trauma con tres camillas, 2 salas de observacion con 9 camas cada una y apoyo de Enfermeria y Laboratorio.;80343;2006;Av. Pedro Chutro 3380;Parque Patricios;4;408;2008-08-04 00:00:00;Arquitectura Salud;Hospital Penna ;TRASPASO Obra a Ministerio correspondiente ;INDALTEC SA;;
ARQSA;La obra comprende la Refuncionalización Integral del Hospital Tobar García, con la provisión de materiales, equipos  y mano de obra especializada. Las renovaciones de que trata el presente pliego afectan una superficie  total estimada  en 9438 m2 , correspondiente a la suma de las superficies de todos los  edificios. Esta superficie involucra remodelación  y obra nueva. Las obras a ejecutar tanto interiores como exteriores tienen por objeto la finalidad de poner el edificio en condiciones adecuadas de funcionamiento, involucrando la totalidad de su superficie, y todas sus instalaciones.;59702;2004;Ramon Carrillo 315 - GCABA;Constitucion;4;408;2006-04-17 00:00:00;Arquitectura Salud;Hospital Tobar Garcia;TRASPASO Obra a Ministerio correspondiente ;RIVA SA;;
AUSA;Esta intervención tiende a poner en valor el área delimitada por las calles Lamadrid, General Hornos, Herrera y Osvaldo Cruz, complementando los trabajos realizados en la primer y segunda etapa, en la cual se revitalizó el tramo comprendido entre la Cabecera Constitución y A. de Lamadrid. Su objetivo es revertir el deterioro del sector y los problemas de inseguridad que sufren en el lugar los vecinos.;LP AUSA 02 2010;2010;AU 9 de Julio Sur entre Gral. A de Lamadrid y Osvaldo Cruz;Barracas, Parque Patricios ;4;998;2010-11-19 00:00:00;Ausa;9 de Julio etapa III;Finalizada recepción definitiva;Bricons SAICFI;;
AUSA;La obra consiste en el tratamiento urbánistico de los secotres aledaños a la AU 9 de julio Sur. Este mejoramiento incluye la cración de nuevos espacios para la práctica de actividades físicas, iluminación, parquización, sistemas de riego, veredas, etc.;215;9;AU 9 de Julio Sur entre Constitución y Gral. A de Lamadrid;Barracas, Parque Patricios;4;998;2009-04-06 00:00:00;Ausa;9 de Julio Sur - Etapa II;Finalizada recepción definitiva;Eleprint SA;;
